{
  "schema_version": "memoryrotbench.chaos_case/v1",
  "case_id": "chaos-idempotent-replay-001",
  "title": "Committed task replay is idempotent",
  "acceptance_case": 11,
  "description": "Replaying the same proposal key must not duplicate writes.",
  "observations": [
    {
      "observation_id": "obs-1",
      "content": "I started at Stripe today."
    }
  ],
  "steps": [
    {
      "step_id": "s1",
      "type": "process_proposal",
      "label": "first_run",
      "proposal": {
        "proposal_id": "proposal-duplicate",
        "idempotency_key": "key-duplicate",
        "claim_id": "claim.alice_stripe",
        "subject": "user:alice",
        "predicate": "works_at",
        "object_value": "Stripe",
        "evidence_spans": [
          {
            "observation_id": "obs-1",
            "start": 0,
            "end": 25
          }
        ]
      },
      "expect": {
        "status": "committed"
      }
    },
    {
      "step_id": "s2",
      "type": "process_proposal",
      "proposal": {
        "proposal_id": "proposal-duplicate",
        "idempotency_key": "key-duplicate",
        "claim_id": "claim.alice_stripe",
        "subject": "user:alice",
        "predicate": "works_at",
        "object_value": "Stripe",
        "evidence_spans": [
          {
            "observation_id": "obs-1",
            "start": 0,
            "end": 25
          }
        ]
      },
      "expect": {
        "status": "duplicate"
      }
    }
  ],
  "final_assertion": {
    "version": 1,
    "active_claim_ids": ["claim.alice_stripe"],
    "evidence_ids": ["obs-1"],
    "current_view": [["user:alice|works_at", "claim.alice_stripe"]],
    "artifact_ids": [],
    "committed_run_ids": ["first_run"],
    "history_claim_ids": ["claim.alice_stripe"]
  }
}
