{
  "schema_version": "memoryrotbench.chaos_case/v1",
  "case_id": "chaos-stale-proposal-race-001",
  "title": "Newer evidence stales an older proposal",
  "acceptance_case": 12,
  "description": "A proposal prepared against an older version should not commit after newer evidence lands.",
  "observations": [
    {
      "observation_id": "obs-1",
      "content": "I work at Acme."
    },
    {
      "observation_id": "obs-2",
      "content": "I started at Stripe today."
    }
  ],
  "steps": [
    {
      "step_id": "s1",
      "type": "process_proposal",
      "label": "acme_run",
      "proposal": {
        "proposal_id": "proposal-acme",
        "idempotency_key": "key-acme",
        "claim_id": "claim.alice_acme",
        "subject": "user:alice",
        "predicate": "works_at",
        "object_value": "Acme",
        "evidence_spans": [
          {
            "observation_id": "obs-1",
            "start": 0,
            "end": 15
          }
        ]
      },
      "expect": {
        "status": "committed"
      }
    },
    {
      "step_id": "s2",
      "type": "process_proposal",
      "label": "stripe_run",
      "proposal": {
        "proposal_id": "proposal-stripe",
        "idempotency_key": "key-stripe",
        "claim_id": "claim.alice_stripe",
        "subject": "user:alice",
        "predicate": "works_at",
        "object_value": "Stripe",
        "replaces_claim_id": "claim.alice_acme",
        "evidence_spans": [
          {
            "observation_id": "obs-2",
            "start": 0,
            "end": 25
          }
        ]
      },
      "expect": {
        "status": "committed"
      }
    },
    {
      "step_id": "s3",
      "type": "process_proposal",
      "proposal": {
        "proposal_id": "proposal-stale-old",
        "idempotency_key": "key-stale-old",
        "claim_id": "claim.alice_github",
        "subject": "user:alice",
        "predicate": "works_at",
        "object_value": "GitHub",
        "precondition_version": 1,
        "evidence_spans": [
          {
            "observation_id": "obs-1",
            "start": 0,
            "end": 15
          }
        ]
      },
      "expect": {
        "status": "stale"
      }
    }
  ],
  "final_assertion": {
    "version": 2,
    "active_claim_ids": ["claim.alice_stripe"],
    "evidence_ids": ["obs-1", "obs-2"],
    "current_view": [["user:alice|works_at", "claim.alice_stripe"]],
    "artifact_ids": [],
    "committed_run_ids": ["acme_run", "stripe_run"],
    "history_claim_ids": ["claim.alice_acme", "claim.alice_stripe"]
  }
}
